{
  "version": "runar-v0.1.0",
  "compilerVersion": "0.1.0",
  "contractName": "Simple",
  "abi": {
    "constructor": { "params": [] },
    "methods": [
      {
        "name": "execute",
        "params": [],
        "isPublic": true
      }
    ]
  },
  "script": "00",
  "asm": "OP_0",
  "buildTimestamp": "2026-04-26T00:00:00Z",
  "stateFields": [],
  "constructorSlots": []
}
